{
  "allowed_implementation_freedom": [
    "Internal language types, module boundaries, algorithms, and storage are unconstrained when every cited observable distinction is preserved.",
    "Exact diagnostic wording and ordering are unconstrained unless a cited authority explicitly requires them."
  ],
  "authorities": [
    {
      "clause": "Repository target",
      "commit": "0ae9a9cb20fd34c0fefa9b4b91f189e98649ea0f",
      "path": "docs/contracts/canonical-governance-routing.md",
      "repository": "fanilosendrison/proto-ring",
      "role": "normative",
      "source_kind": "repository"
    },
    {
      "clause": "Co-authorities",
      "commit": "662d86d445cefed4e17aa3cfa897ac36344cba89",
      "path": "docs/contracts/governance-authority.md",
      "repository": "fanilosendrison/proto-ring",
      "role": "normative",
      "source_kind": "repository"
    },
    {
      "clause": "Governed sources",
      "commit": "662d86d445cefed4e17aa3cfa897ac36344cba89",
      "path": "docs/contracts/governance-authority.md",
      "repository": "fanilosendrison/proto-ring",
      "role": "normative",
      "source_kind": "repository"
    },
    {
      "clause": "Lookup states",
      "commit": "662d86d445cefed4e17aa3cfa897ac36344cba89",
      "path": "docs/contracts/governance-authority.md",
      "repository": "fanilosendrison/proto-ring",
      "role": "normative",
      "source_kind": "repository"
    },
    {
      "clause": "Model-version-1 profile",
      "commit": "662d86d445cefed4e17aa3cfa897ac36344cba89",
      "path": "docs/contracts/governance-authority.md",
      "repository": "fanilosendrison/proto-ring",
      "role": "normative",
      "source_kind": "repository"
    },
    {
      "clause": "Precedence",
      "commit": "662d86d445cefed4e17aa3cfa897ac36344cba89",
      "path": "docs/contracts/governance-authority.md",
      "repository": "fanilosendrison/proto-ring",
      "role": "normative",
      "source_kind": "repository"
    },
    {
      "clause": "Repository Governance Model integration",
      "commit": "662d86d445cefed4e17aa3cfa897ac36344cba89",
      "path": "docs/contracts/governance-authority.md",
      "repository": "fanilosendrison/proto-ring",
      "role": "normative",
      "source_kind": "repository"
    },
    {
      "clause": "Secondary representations",
      "commit": "662d86d445cefed4e17aa3cfa897ac36344cba89",
      "path": "docs/contracts/governance-authority.md",
      "repository": "fanilosendrison/proto-ring",
      "role": "normative",
      "source_kind": "repository"
    },
    {
      "clause": "Source roles",
      "commit": "662d86d445cefed4e17aa3cfa897ac36344cba89",
      "path": "docs/contracts/governance-authority.md",
      "repository": "fanilosendrison/proto-ring",
      "role": "normative",
      "source_kind": "repository"
    }
  ],
  "blocking_gaps": [],
  "canonical_input_forms": [
    "routed canonical structured Governance Authority profile"
  ],
  "case_file": "cases/governance-authority.profile.matrix.json",
  "frozen_baseline_modules": [
    "governance_authority.py"
  ],
  "migration_disposition": "rust_port",
  "non_normative_behaviors": [
    "Python object types, exception classes, module layout, and incidental algorithms are not semantic authority.",
    "Rust crate, module, and internal type layout are not semantic authority."
  ],
  "post_baseline_implementation_carriers": [],
  "python_retirement_owner": 73,
  "required_state_distinctions": [
    "the exact serialized roles are authority, secondary_representation, and non_authoritative",
    "one authority source is valid",
    "multiple incomparable authority sources are valid",
    "one source may have different roles by responsibility",
    "absent responsibility lookup is UNKNOWN_RESPONSIBILITY",
    "known responsibility without the source assignment is UNDECLARED",
    "malformed lookup input fails closed rather than becoming a role",
    "a known responsibility with empty roles is valid",
    "a secondary representation with at least one authority is valid",
    "a secondary representation without any authority is rejected",
    "a valid authority-to-authority precedence edge is accepted",
    "transitive precedence establishes outranking",
    "precedence does not remove authority from lower sources",
    "a precedence cycle is rejected",
    "a precedence self edge is rejected",
    "an exact duplicate precedence edge is rejected",
    "a precedence endpoint naming an undeclared source is rejected",
    "a declared precedence endpoint without a role for the responsibility is rejected",
    "a secondary-representation precedence endpoint is rejected",
    "a non-authoritative precedence endpoint is rejected",
    "repository targets resolve through Canonical Governance Routing",
    "repository_target resolution preserves Canonical Governance Routing traversal failures",
    "body prose cannot alter structured authority declarations",
    "an unknown serialized role is rejected",
    "a role referencing an undeclared source is rejected"
  ],
  "responsibility_id": "governance-authority.profile",
  "rust_owner_issue": 65,
  "schema_version": "1.0",
  "title": "Governance Authority profile"
}
