{
  "allowed_implementation_freedom": [
    "Internal language types, module boundaries, algorithms, and storage are unconstrained when every cited observable distinction is preserved.",
    "Exact diagnostic wording and ordering are unconstrained unless a cited authority explicitly requires them."
  ],
  "authorities": [
    {
      "clause": "Composition with Exact Evidence Binding",
      "commit": "662d86d445cefed4e17aa3cfa897ac36344cba89",
      "path": "docs/contracts/evidence-requirements.md",
      "repository": "fanilosendrison/proto-ring",
      "role": "normative",
      "source_kind": "repository"
    },
    {
      "clause": "Current versus historical requirement",
      "commit": "662d86d445cefed4e17aa3cfa897ac36344cba89",
      "path": "docs/contracts/exact-evidence-binding.md",
      "repository": "fanilosendrison/proto-ring",
      "role": "normative",
      "source_kind": "repository"
    },
    {
      "clause": "Exact subject binding",
      "commit": "662d86d445cefed4e17aa3cfa897ac36344cba89",
      "path": "docs/contracts/exact-evidence-binding.md",
      "repository": "fanilosendrison/proto-ring",
      "role": "normative",
      "source_kind": "repository"
    },
    {
      "clause": "Explicit evidence-class admission",
      "commit": "662d86d445cefed4e17aa3cfa897ac36344cba89",
      "path": "docs/contracts/exact-evidence-binding.md",
      "repository": "fanilosendrison/proto-ring",
      "role": "normative",
      "source_kind": "repository"
    },
    {
      "clause": "Fail-closed use of mandatory binding",
      "commit": "662d86d445cefed4e17aa3cfa897ac36344cba89",
      "path": "docs/contracts/exact-evidence-binding.md",
      "repository": "fanilosendrison/proto-ring",
      "role": "normative",
      "source_kind": "repository"
    },
    {
      "clause": "MATCH / MISMATCH / UNDETERMINED",
      "commit": "662d86d445cefed4e17aa3cfa897ac36344cba89",
      "path": "docs/contracts/exact-evidence-binding.md",
      "repository": "fanilosendrison/proto-ring",
      "role": "normative",
      "source_kind": "repository"
    },
    {
      "clause": "MATCH / MISMATCH / UNDETERMINED / MATCH",
      "commit": "662d86d445cefed4e17aa3cfa897ac36344cba89",
      "path": "docs/contracts/exact-evidence-binding.md",
      "repository": "fanilosendrison/proto-ring",
      "role": "normative",
      "source_kind": "repository"
    },
    {
      "clause": "MATCH / MISMATCH / UNDETERMINED / MISMATCH",
      "commit": "662d86d445cefed4e17aa3cfa897ac36344cba89",
      "path": "docs/contracts/exact-evidence-binding.md",
      "repository": "fanilosendrison/proto-ring",
      "role": "normative",
      "source_kind": "repository"
    },
    {
      "clause": "MATCH / MISMATCH / UNDETERMINED / UNDETERMINED",
      "commit": "662d86d445cefed4e17aa3cfa897ac36344cba89",
      "path": "docs/contracts/exact-evidence-binding.md",
      "repository": "fanilosendrison/proto-ring",
      "role": "normative",
      "source_kind": "repository"
    },
    {
      "clause": "No implicit evidence substitution",
      "commit": "662d86d445cefed4e17aa3cfa897ac36344cba89",
      "path": "docs/contracts/exact-evidence-binding.md",
      "repository": "fanilosendrison/proto-ring",
      "role": "normative",
      "source_kind": "repository"
    },
    {
      "clause": "Opaque identity tokens",
      "commit": "662d86d445cefed4e17aa3cfa897ac36344cba89",
      "path": "docs/contracts/exact-evidence-binding.md",
      "repository": "fanilosendrison/proto-ring",
      "role": "normative",
      "source_kind": "repository"
    },
    {
      "clause": "Optional-but-explicit context binding",
      "commit": "662d86d445cefed4e17aa3cfa897ac36344cba89",
      "path": "docs/contracts/exact-evidence-binding.md",
      "repository": "fanilosendrison/proto-ring",
      "role": "normative",
      "source_kind": "repository"
    },
    {
      "clause": "Requirement authority",
      "commit": "662d86d445cefed4e17aa3cfa897ac36344cba89",
      "path": "docs/contracts/exact-evidence-binding.md",
      "repository": "fanilosendrison/proto-ring",
      "role": "normative",
      "source_kind": "repository"
    }
  ],
  "blocking_gaps": [],
  "canonical_input_forms": [
    "one concrete EvidenceRequirement and optional candidate EvidenceBinding"
  ],
  "case_file": "cases/exact-evidence-binding.evaluate.matrix.json",
  "frozen_baseline_modules": [
    "exact_evidence_binding.py"
  ],
  "migration_disposition": "rust_port",
  "non_normative_behaviors": [
    "Python object types, exception classes, module layout, and incidental algorithms are not semantic authority.",
    "Rust crate, module, and internal type layout are not semantic authority."
  ],
  "post_baseline_implementation_carriers": [],
  "python_retirement_owner": 73,
  "required_state_distinctions": [
    "a historical match does not authorize changed current subject or context",
    "absent candidate evidence yields UNDETERMINED",
    "an unadmitted class receives no implicit alias or fallback",
    "any exact member of a multi-class admission set can MATCH",
    "candidate context is ignored when requirement context is not required",
    "duplicate admitted evidence classes are rejected rather than silently deduplicated",
    "empty candidate class yields UNDETERMINED",
    "empty candidate context is ignored completely when context is not required",
    "empty candidate subject token yields UNDETERMINED",
    "empty class precedes context mismatch yields UNDETERMINED before mismatch adjudication",
    "empty class precedes subject mismatch yields UNDETERMINED before mismatch adjudication",
    "empty context precedes class mismatch yields UNDETERMINED before mismatch adjudication",
    "empty context precedes subject mismatch yields UNDETERMINED before mismatch adjudication",
    "empty required candidate context token yields UNDETERMINED",
    "empty subject precedes class mismatch yields UNDETERMINED before mismatch adjudication",
    "empty subject precedes context mismatch yields UNDETERMINED before mismatch adjudication",
    "exact admitted class and subject yields MATCH when context is not required",
    "exact class, subject, and required context yields MATCH",
    "known unadmitted class yields MISMATCH",
    "known unequal required context yields MISMATCH",
    "known unequal subject token yields MISMATCH",
    "missing candidate class precedes a known context mismatch",
    "missing candidate class yields UNDETERMINED",
    "missing candidate subject precedes a known context mismatch",
    "missing candidate subject yields UNDETERMINED",
    "missing class precedes subject mismatch yields UNDETERMINED before mismatch adjudication",
    "missing context precedes class mismatch yields UNDETERMINED before mismatch adjudication",
    "missing context precedes subject mismatch yields UNDETERMINED before mismatch adjudication",
    "missing required candidate context yields UNDETERMINED",
    "missing subject precedes class mismatch yields UNDETERMINED before mismatch adjudication",
    "required unknown current context yields UNDETERMINED",
    "requirement context forbidden is a controlled structural rejection",
    "requirement empty class is a controlled structural rejection",
    "requirement empty classes is a controlled structural rejection",
    "requirement empty required context is a controlled structural rejection",
    "requirement empty subject is a controlled structural rejection",
    "unknown context precedes class mismatch yields UNDETERMINED before mismatch adjudication",
    "unknown context precedes subject mismatch yields UNDETERMINED before mismatch adjudication",
    "unknown current subject precedes a known context mismatch",
    "unknown current subject remains UNDETERMINED with semantically malformed candidate evidence",
    "unknown current subject yields UNDETERMINED",
    "unknown current subject yields UNDETERMINED even when class appears mismatched",
    "unknown required current context remains UNDETERMINED with semantically malformed candidate evidence"
  ],
  "responsibility_id": "exact-evidence-binding.evaluate",
  "rust_owner_issue": 66,
  "schema_version": "1.0",
  "title": "Exact Evidence Binding evaluation"
}
