{
  "allowed_implementation_freedom": [
    "Internal language types, module boundaries, algorithms, and storage are unconstrained when every cited observable distinction is preserved.",
    "Exact diagnostic wording and ordering are unconstrained unless a cited authority explicitly requires them."
  ],
  "authorities": [
    {
      "clause": "Failure behavior",
      "commit": "f1cc389ccbd468165b877fa1b14e468110545113",
      "path": "docs/contracts/normative-terminology.md",
      "repository": "fanilosendrison/proto-ring",
      "role": "normative",
      "source_kind": "repository"
    },
    {
      "clause": "Markdown structural model",
      "commit": "f1cc389ccbd468165b877fa1b14e468110545113",
      "path": "docs/contracts/normative-terminology.md",
      "repository": "fanilosendrison/proto-ring",
      "role": "normative",
      "source_kind": "repository"
    }
  ],
  "blocking_gaps": [],
  "canonical_input_forms": [
    "document text and consumer structural format"
  ],
  "case_file": "cases/normative-terminology.markdown.matrix.json",
  "frozen_baseline_modules": [
    "normative_terminology.py"
  ],
  "migration_disposition": "rust_port",
  "non_normative_behaviors": [
    "Python object types, exception classes, module layout, and incidental algorithms are not semantic authority.",
    "Rust crate, module, and internal type layout are not semantic authority."
  ],
  "post_baseline_implementation_carriers": [],
  "python_retirement_owner": 73,
  "required_state_distinctions": [
    "ATX headings with zero to three spaces and closing hashes parse structurally",
    "fenced code blocks beginning with triple backticks or tildes are discovered by the Markdown structural model with their exact structural text/context preserved",
    "ordinary paragraph lines join into exact block text",
    "a full-line registered canonical anchor is recognized",
    "a duplicate canonical anchor is rejected",
    "a canonical-looking unregistered anchor is rejected",
    "a canonical anchor binds only the first following parsed block in the same section"
  ],
  "responsibility_id": "normative-terminology.markdown",
  "rust_owner_issue": 64,
  "schema_version": "1.0",
  "title": "Normative Terminology Markdown structure"
}
