{
  "allowed_implementation_freedom": [
    "Internal language types, module boundaries, algorithms, and storage are unconstrained when every cited observable distinction is preserved.",
    "Exact diagnostic wording and ordering are unconstrained unless a cited authority explicitly requires them."
  ],
  "authorities": [
    {
      "clause": "Source roles",
      "commit": "662d86d445cefed4e17aa3cfa897ac36344cba89",
      "path": "docs/contracts/governance-authority.md",
      "repository": "fanilosendrison/proto-ring",
      "role": "normative",
      "source_kind": "repository"
    },
    {
      "clause": "Exact identity semantics",
      "commit": "662d86d445cefed4e17aa3cfa897ac36344cba89",
      "path": "docs/contracts/governed-objects.md",
      "repository": "fanilosendrison/proto-ring",
      "role": "normative",
      "source_kind": "repository"
    },
    {
      "clause": "Active ambiguity",
      "commit": "662d86d445cefed4e17aa3cfa897ac36344cba89",
      "path": "docs/contracts/projection-integrity.md",
      "repository": "fanilosendrison/proto-ring",
      "role": "normative",
      "source_kind": "repository"
    },
    {
      "clause": "Authority and direct-source composition",
      "commit": "662d86d445cefed4e17aa3cfa897ac36344cba89",
      "path": "docs/contracts/projection-integrity.md",
      "repository": "fanilosendrison/proto-ring",
      "role": "normative",
      "source_kind": "repository"
    },
    {
      "clause": "Authority and evidence boundaries",
      "commit": "662d86d445cefed4e17aa3cfa897ac36344cba89",
      "path": "docs/contracts/projection-integrity.md",
      "repository": "fanilosendrison/proto-ring",
      "role": "normative",
      "source_kind": "repository"
    },
    {
      "clause": "Direct-source rule",
      "commit": "662d86d445cefed4e17aa3cfa897ac36344cba89",
      "path": "docs/contracts/projection-integrity.md",
      "repository": "fanilosendrison/proto-ring",
      "role": "normative",
      "source_kind": "repository"
    },
    {
      "clause": "Governed identity boundary",
      "commit": "662d86d445cefed4e17aa3cfa897ac36344cba89",
      "path": "docs/contracts/projection-integrity.md",
      "repository": "fanilosendrison/proto-ring",
      "role": "normative",
      "source_kind": "repository"
    },
    {
      "clause": "Mechanically significant embedded assertions",
      "commit": "662d86d445cefed4e17aa3cfa897ac36344cba89",
      "path": "docs/contracts/projection-integrity.md",
      "repository": "fanilosendrison/proto-ring",
      "role": "normative",
      "source_kind": "repository"
    },
    {
      "clause": "Optional Governance Binding reference",
      "commit": "662d86d445cefed4e17aa3cfa897ac36344cba89",
      "path": "docs/contracts/projection-integrity.md",
      "repository": "fanilosendrison/proto-ring",
      "role": "normative",
      "source_kind": "repository"
    },
    {
      "clause": "Optional governed-object target",
      "commit": "662d86d445cefed4e17aa3cfa897ac36344cba89",
      "path": "docs/contracts/projection-integrity.md",
      "repository": "fanilosendrison/proto-ring",
      "role": "normative",
      "source_kind": "repository"
    },
    {
      "clause": "Persistent Projection Registry",
      "commit": "662d86d445cefed4e17aa3cfa897ac36344cba89",
      "path": "docs/contracts/projection-integrity.md",
      "repository": "fanilosendrison/proto-ring",
      "role": "normative",
      "source_kind": "repository"
    },
    {
      "clause": "Persistent mode fields",
      "commit": "662d86d445cefed4e17aa3cfa897ac36344cba89",
      "path": "docs/contracts/projection-integrity.md",
      "repository": "fanilosendrison/proto-ring",
      "role": "normative",
      "source_kind": "repository"
    },
    {
      "clause": "Projection modes",
      "commit": "662d86d445cefed4e17aa3cfa897ac36344cba89",
      "path": "docs/contracts/projection-integrity.md",
      "repository": "fanilosendrison/proto-ring",
      "role": "normative",
      "source_kind": "repository"
    },
    {
      "clause": "Projection modes / Bounded historical snapshot",
      "commit": "662d86d445cefed4e17aa3cfa897ac36344cba89",
      "path": "docs/contracts/projection-integrity.md",
      "repository": "fanilosendrison/proto-ring",
      "role": "normative",
      "source_kind": "repository"
    },
    {
      "clause": "Projection modes / Generated projection",
      "commit": "662d86d445cefed4e17aa3cfa897ac36344cba89",
      "path": "docs/contracts/projection-integrity.md",
      "repository": "fanilosendrison/proto-ring",
      "role": "normative",
      "source_kind": "repository"
    },
    {
      "clause": "Projection modes / Mechanically validated maintained projection",
      "commit": "662d86d445cefed4e17aa3cfa897ac36344cba89",
      "path": "docs/contracts/projection-integrity.md",
      "repository": "fanilosendrison/proto-ring",
      "role": "normative",
      "source_kind": "repository"
    },
    {
      "clause": "Projection modes / Reference",
      "commit": "662d86d445cefed4e17aa3cfa897ac36344cba89",
      "path": "docs/contracts/projection-integrity.md",
      "repository": "fanilosendrison/proto-ring",
      "role": "normative",
      "source_kind": "repository"
    },
    {
      "clause": "Repository Integrity validation binding",
      "commit": "662d86d445cefed4e17aa3cfa897ac36344cba89",
      "path": "docs/contracts/projection-integrity.md",
      "repository": "fanilosendrison/proto-ring",
      "role": "normative",
      "source_kind": "repository"
    },
    {
      "clause": "Validation ownership",
      "commit": "662d86d445cefed4e17aa3cfa897ac36344cba89",
      "path": "docs/contracts/projection-integrity.md",
      "repository": "fanilosendrison/proto-ring",
      "role": "normative",
      "source_kind": "repository"
    }
  ],
  "blocking_gaps": [],
  "canonical_input_forms": [
    "routed projection registry and composed authority, object, binding and integrity values"
  ],
  "case_file": "cases/projection-registry.registry.matrix.json",
  "frozen_baseline_modules": [
    "projection_registry.py"
  ],
  "migration_disposition": "rust_port",
  "non_normative_behaviors": [
    "Python object types, exception classes, module layout, and incidental algorithms are not semantic authority.",
    "Rust crate, module, and internal type layout are not semantic authority."
  ],
  "post_baseline_implementation_carriers": [],
  "python_retirement_owner": 73,
  "required_state_distinctions": [
    "reference mode forbids generator and boundary fields",
    "generated mode requires a non-authoritative generator source",
    "mechanically validated maintained mode forbids generator and boundary fields",
    "bounded historical mode requires an authority boundary source",
    "required and forbidden fields are enforced exactly by mode",
    "canonical and secondary sources must be distinct and have exact roles",
    "every projection ValidationId exists in Repository Integrity",
    "an optional governed-object target must resolve when present",
    "an optional BindingId must align responsibility and canonical source",
    "conflicting active declarations for one effective key are rejected",
    "distinct logical direct sources sharing a physical carrier are admitted",
    "bounded historical relationships do not create active current conflict",
    "registry loading performs no validation, generation, or repair"
  ],
  "responsibility_id": "projection-registry.registry",
  "rust_owner_issue": 66,
  "schema_version": "1.0",
  "title": "Projection Registry"
}
